[
  {
    "aseq": 18,
    "assignment_id": null,
    "at": "2026-10-09T11:53:21.489Z",
    "chat_id": "dm_01a1204f-aab3-7180-88c7-501d2cbb02d0",
    "data": {
      "latency_ms": 2324,
      "request_id": "run_chat_01a1207c_2473_74b1_8f70_28952f6259f6:llm:3",
      "stop_reason": "end_turn",
      "text": "macbot-e2e-s1-669c2d8f6eda and the path is e2e/macbot-e2e-s1-669c2d8f6eda.txt",
      "thinking": "All three tool calls were successful:\n1. Write: wrote 26 bytes to the file\n2. Read: returned \"macbot-e2e-s1-669c2d8f6eda\"\n3. Bash cat: returned \"macbot-e2e-s1-669c2d8f6eda\"\n\nNow I need to reply with the marker and the path.",
      "tool_calls": [],
      "ttft_ms": 807,
      "usage": {
        "cache_read_tokens": 443,
        "cache_write_tokens": 0,
        "cost": null,
        "input_tokens": 4259,
        "output_tokens": 123,
        "requests": 1
      }
    },
    "run_id": "run_chat_01a1207c_2473_74b1_8f70_28952f6259f6",
    "type": "llm.response"
  },
  {
    "aseq": 19,
    "assignment_id": null,
    "at": "2026-10-09T11:53:21.537Z",
    "chat_id": "dm_01a1204f-aab3-7180-88c7-501d2cbb02d0",
    "data": {
      "error": null,
      "status": "done"
    },
    "run_id": "run_chat_01a1207c_2473_74b1_8f70_28952f6259f6",
    "type": "run.end"
  },
  {
    "aseq": 20,
    "assignment_id": null,
    "at": "2026-10-09T11:54:22.052Z",
    "chat_id": "dm_01a1204f-aab3-7180-88c7-501d2cbb02d0",
    "data": {
      "model": "prv_01a1204f-5654-7576-ba57-281f6ef55d71/MiniMax-M2.5",
      "parent_run_id": null,
      "phase": "chat",
      "subagent_task": null
    },
    "run_id": "run_chat_01a12083_a98c_7532_86cc_2155c74fbe0f",
    "type": "run.start"
  },
  {
    "aseq": 21,
    "assignment_id": null,
    "at": "2026-10-09T11:54:22.084Z",
    "chat_id": "dm_01a1204f-aab3-7180-88c7-501d2cbb02d0",
    "data": {
      "context": {
        "l0": 733,
        "l1": 0,
        "l2": 0,
        "l3": 0,
        "l4": 0,
        "total": 733
      },
      "model": "prv_01a1204f-5654-7576-ba57-281f6ef55d71/MiniMax-M2.5",
      "prompt_ref": null,
      "request_id": "run_chat_01a12083_a98c_7532_86cc_2155c74fbe0f:llm:0",
      "tools": [
        "memory",
        "browser_nav",
        "browser_tabs",
        "browser_eval",
        "ls",
        "write",
        "browser_screenshot",
        "browser_wait",
        "subagent",
        "browser_open",
        "project_find",
        "bash_job",
        "session_search",
        "edit",
        "browser_act",
        "find",
        "skill",
        "request_takeover",
        "bash",
        "chat_history",
        "memory_search",
        "browser_snapshot",
        "browser_get",
        "grep",
        "question",
        "read",
        "send_msg"
      ]
    },
    "run_id": "run_chat_01a12083_a98c_7532_86cc_2155c74fbe0f",
    "type": "llm.request"
  },
  {
    "aseq": 22,
    "assignment_id": null,
    "at": "2026-10-09T11:54:25.533Z",
    "chat_id": "dm_01a1204f-aab3-7180-88c7-501d2cbb02d0",
    "data": {
      "latency_ms": 3424,
      "request_id": "run_chat_01a12083_a98c_7532_86cc_2155c74fbe0f:llm:0",
      "stop_reason": "tool_use",
      "text": "",
      "thinking": "The user wants me to:\n1. Write exactly \"macbot-e2e-s1-669c2d8f6eda\" to a file at e2e/macbot-e2e-s1-669c2d8f6eda.txt\n2. Read that file back\n3. Use bash to cat the file\n4. Then reply with macbot-e2e-s1-669c2d8f6eda and the path\n\nLet me start with the write operation.",
      "tool_calls": [
        {
          "args": {
            "content": "macbot-e2e-s1-669c2d8f6eda",
            "path": "e2e/macbot-e2e-s1-669c2d8f6eda.txt"
          },
          "call_id": "call_function_wdjcbo45mnxf_1",
          "name": "write"
        }
      ],
      "ttft_ms": 817,
      "usage": {
        "cache_read_tokens": 0,
        "cache_write_tokens": 0,
        "cost": null,
        "input_tokens": 3587,
        "output_tokens": 174,
        "requests": 1
      }
    },
    "run_id": "run_chat_01a12083_a98c_7532_86cc_2155c74fbe0f",
    "type": "llm.response"
  },
  {
    "aseq": 23,
    "assignment_id": null,
    "at": "2026-10-09T11:54:25.547Z",
    "chat_id": "dm_01a1204f-aab3-7180-88c7-501d2cbb02d0",
    "data": {
      "args": {
        "content": "macbot-e2e-s1-669c2d8f6eda",
        "path": "e2e/macbot-e2e-s1-669c2d8f6eda.txt"
      },
      "call_id": "call_function_wdjcbo45mnxf_1",
      "name": "write"
    },
    "run_id": "run_chat_01a12083_a98c_7532_86cc_2155c74fbe0f",
    "type": "tool.start"
  },
  {
    "aseq": 24,
    "assignment_id": null,
    "at": "2026-10-09T11:54:25.569Z",
    "chat_id": "dm_01a1204f-aab3-7180-88c7-501d2cbb02d0",
    "data": {
      "message_id": null,
      "reason": "approval"
    },
    "run_id": "run_chat_01a12083_a98c_7532_86cc_2155c74fbe0f",
    "type": "run.wait"
  }
]
