{
  "aseq": 1,
  "assignment_id": "asg_1",
  "at": "2026-10-09T10:19:02.312Z",
  "chat_id": "chat_login",
  "data": {
    "call_id": "call_1",
    "details": {},
    "duration_ms": 10,
    "full_output": null,
    "is_error": false,
    "preview": "ok",
    "truncated": false
  },
  "run_id": "run_1",
  "type": "tool.end"
}
